,album,lyric,title,artist
35,NadaComoUmDiaApósoOutroDiaDisco1ChoraAgora,"A Vida É Desafio Lyrics[Intro: Afro-X]
Sempre fui sonhador! É isso que me mantem vivo
Quando pivete, meu sonho era ser jogador de futebol. Vai vendo...
Mas o sistema limita nossa vida de tal forma, que eu tive que fazer minha escolha: sonhar ou sobreviver
Os anos se passaram e eu fui me esquivando do ciclo vicioso
Porém o capitalismo me obrigou a ser bem sucedido
Acredito que o sonho de todo pobre, é ser rico
Em busca do meu sonho de consumo procurei dar uma solução rápida e fácil pros meus problemas: o crime
Mas é um dinheiro amaldiçoado, quanto mais eu ganhava, mais eu gastava
Logo fui cobrado pela lei da natureza, vish... 14 anos de reclusão... Barato é loko, óh
[Verso 1: Edi Rock]
É necessário sempre acreditar que o sonho é possível
Que o céu é o limite e você, truta, é imbatível
Que o tempo ruim vai passar, é só uma fase
Que o sofrimento alimenta mais a sua coragem
Que a sua família precisa de você
Lado a lado se ganhar pra te apoiar se perder
Falo do amor entre homem, filho e mulher
A única verdade universal que mantém a fé
Olhe as crianças que é o futuro e a esperança
Que ainda não conhece, não sente o que é ódio e ganância
Eu vejo o rico que teme perder a fortuna
Enquanto o mano desempregado, viciado, se afunda
Falo do enfermo, falo do são
Falo da rua aqui pra esse louco mundão
Que o caminho da cura pode ser a doença
Que o caminho do perdão às vezes é a sentença
Desavença, treta e falsa união
A ambição como um véu que cega os irmãos
Que nem um carro guiado na estrada da vida
Sem farol no deserto das trevas perdidas
Eu fui orgia, ébrio, louco, mas hoje ando sóbrio
Guardo o revólver enquanto você me fala em ódio
Eu vejo o corpo, a mente, a alma, o espírito
Ouço o repente e o que diz lá no canto lírico
Falo do cérebro e do coração
Vejo egoísmo, preconceito, de irmão para irmão
A vida não é o problema, é batalha, desafio
Cada obstáculo é uma lição, eu anuncio
You might also like[Refrão]
É isso aí, você não pode parar
Esperar o tempo ruim vir te abraçar
Acreditar que sonhar sempre é preciso
É o que mantém os irmãos vivos

[Verso 2: Edi Rock]
Várias famílias, vários barracos
Uma mina grávida
E o mano tá lá trancafiado
Ele sonha na direta com a liberdade
Ele sonha em um dia voltar pra rua longe da maldade
Na cidade grande é assim
Você espera tempo bom e o que vem é só tempo ruim
No esporte, no boxe ou no futebol
Alguém sonhando com uma medalha o seu lugar ao sol
Porém fazer o quê se o maluco não estudou
500 anos de Brasil e o Brasil aqui nada mudou
""Desespero ali, cena do louco
Invadiu o mercado farinhado, armado e mais um pouco""
Isso é reflexo da nossa atualidade
Esse é o espelho derradeiro da realidade
Não é areia, conversa, chaveco
Porque o sonho de vários na quebrada é abrir um boteco
Ser empresário não dá, estudar nem pensar
Tem que trampar ou ripar para os irmãos sustentar
Ser criminoso aqui é bem mais prático
Rápido, sádico, ou simplesmente esquema tático
Será instinto ou consciência
Viver entre o sonho e a merda da sobrevivência
[Interlúdio: Afro-X]
O aprendizado foi duro e mesmo diante desse revés não parei de sonhar
Fui persistente porque o fraco não alcança a meta
Através do rap corri atrás do preju e pude realizar o meu sonho
Por isso que eu, Afro-X, nunca deixo de sonhar

[Verso 3: Edi Rock]
Conheci o paraíso e eu conheço o inferno
Vi Jesus de calça bege e o diabo vestido de terno
No mundo moderno, as pessoas não se falam
Ao contrário se calam, se pisam, se traem e se matam
Embaralho, as cartas da inveja e da traição
Copa, ouro e uma espada na mão
O que é bom pra si e o que sobra é do outro
Que nem o sol que aquece, mas também apodrece o esgoto
É muito louco olhar as pessoas
A atitude do mal influencia a minoria boa
Morrer à toa, que mais?
Matar à toa e que mais?
Ir preso à toa, sonhando com uma fita boa
A vida voa e o futuro pega
Quem se firmou, falo
Quem não ganhou, o jogo entrega
Mais uma queda em 15 milhões
Na mais rica metrópole, suas várias contradições
É incontável, inaceitável, implacável, inevitável
Ver o lado miserável se sujeitando com migalhas, favores
Se esquivando entre noite de medo e horrores
Qual é a fita, treta, cena
A gente reza, foge, e continua sempre os mesmos problemas
Mulher e dinheiro tá sempre envolvido
Vaidade, ambição: munição pra criar inimigo
Desde o povo antigo foi sempre assim
Quem não se lembra que Abel foi morto por Caim
Enfim quero vencer sem pilantrar com ninguém
Quero dinheiro sem pisar na cabeça de alguém
O certo é certo na guerra ou na paz
Se for um sonho, não me acorde nunca mais
Roleta russa quanto custa engatilhar
Eu pago o dobro pra você em mim acreditar

[Refrão]
""É isso aí, você não pode parar
Esperar o tempo ruim vir te abraçar
Acreditar que sonhar sempre é preciso
É o que mantém os irmãos vivos""

[Saída: Edi Rock]
Geralmente quando os problemas aparecem
A gente tá desprevenido, né, não?
Errado!
É você que perdeu o controle da situação, sangue bom
Perdeu a capacidade de controlar os desafios
Principalmente quando a gente foge das lição
Que a vida coloca na nossa frente
Você se acha sempre incapaz de resolver
Se acovarda, moro?
O pensamento é a força criadora
O amanhã é ilusório
Porque ainda não existe
O hoje é real
É a realidade que você pode interferir
As oportunidades de mudança
Tá no presente
Não espere o futuro mudar sua vida
Porque o futuro será a consequência do presente
Parasita hoje
Um coitado amanhã
Corrida hoje
Vitória amanhã
Nunca esqueça disso, irmão2Embed",a-vida-e-desafio,Racionais-mcs
36,NadaComoUmDiaApósoOutroDiaDisco1ChoraAgora,"1 Por Amor, 2 Por Dinheiro Lyrics[Intro: Vanessa Jackson]
Na zona sul heeeeey
[Intro: Mano Brown]
Essa é dedicada para todos os
MC's do Brasil que veio do sofrimento
Rimando e exercendo a profissão perigo
É tudo nosso, tudo nosso, tudo nosso

[Verso 1: Mano Brown, Ice Blue, Rosana Bronk's]
Quem é você que fala o que quer
Que se esconde igual mulher por trás da caneta
Vai Zé buceta sai da sombra, cai então toma seu mundo é o chão
Quem tem cu tem medo e treme
Mostra a cara Mister M
Vem pra ver como é bom poder chegar na alta cúpula
E entrar sem pagar simpatia
Promessas vazia, caô, caô
Nem vem, nem vem sofredor aqui tem sensor
Não tem rei, não tem réu, pai de mel, bam-bam-bam
Quem age certo é que fala é que pam
Andarilho ou idoso ou bom criminoso
Igual depois da pólvora não tem cabuloso
Eu nunca quis nem vou agradar todo mundo
E rir pra tudo quanto é que se diz vagabundo
O rei dos reis foi traído na terra
Morrer como o homem é o prêmio da guerra
Sem menção honrosa sem massagem
A vida é loka, nego, nela eu tô de passagem
Zum, zum, zum, zum, zum
Meu cérebro balançou século XXI
Revolução não é pra qualquer um só quem é
Kamikaze leal, guerreiro de fé
Se o Rap é um jogo, eu sou jogador nato
Errou, o Rap é uma guerra e eu sou gladiador
Pra jogar, pra lutar, pra matar pra morrer sorrindo
Esmagando vermes, quebrando e falindo cassinos
Eu vou sair pra descolar um qualquer
Meu pivete já conta pá amanhã no café
Se o crime é uma doença eu conheço infecção
Nem por isso eu sou pá no plano de ninguém Jão
1 por amor, 2 por dinheiro, 3 pela África, 4 pros parceiro
Que estão na guerra sem medo de errar
Quem quiser falar só Deus pode julgar
10 cadeira numa mesa de mármore
Com 10 nego em volta falando assim:
Mil pra você mil pra mim (O que?)
Mil pra você mil pra mim (Tem mais?)
Mil pra você mil pra mim (E o meu?)
Mil pra você mil pra mim
Doidão, tá firmão, tá feliz
No sapatinho, ai sim
Não vai deixar seu pivete ao léu
Na mão de um cara pálida de topete e gel
Sensacional
[Ponte: DJ Nel]
Hei hei
Nego aqui quem fala é o Wattsom do momento DJ Nel via
Satélite mantendo o clima quente
Até nas quartas-feiras cinzas da vida
Ei quebrada eu vejo seus olhos
Tristes tentando ver a luz este som é Funk e a frase
Do dia é (hei) as palavras nunca voltam vazias

[Refrão: Rosana Bronk's]
1 por amor 2 pelo dinheiro
Vida loka Capão de fé sou guerreiro
1 por amor 2 pelo dinheiro
Vida loka Capão de fé sou guerreiro

[Verso 2: Rosana Bronk's]
E esses Mano ai de bombeta branca e vinho
Agitando a festa chega no bolinho
Respeita doidão ai não fala assim
Bolinho pra você é família pra mim
Veja bem e escuta a natu
O espírito mau o loko da Zona Sul
Eu vivo a reali vou superar
A missão do sofredor é se adiantar
É quente, a é quente quente
Vale das Virtudes é nós no pente
Já era boyzão cê sabe como é
O bagulho tá doido cê tem um qualquer
Mãe e Irmão, Irmã e Sobrinho
Se o dinheiro constar eu não gasto sozinho
Ei camarada a cara é correr
A quebrada é sofrida, eu também fazer o que
Dinheiro no bolso Deus no coração
Família unida champanhe pros irmão
Amor pela mãe, ocupa o meu tempo
Um coração puro quanto mundo enfermo
Não há nada na vida que o amor não supere
O mundão desandou, ei você não se entrege
Olha ao seu redor a expansão do terror
Apocalipse já que o profeta pregou
Você trai por amor ao luxo
O dinheiro agora sem dor nem escrúpulo
Ei ouve o que a rima fala
Entre a compra e a venda o pecado se estala
Certo tio é o neguinho que tá na cena
Vida loka família Jardim Rosana é arena
Vindo do emprego e meio ao Robocop
De Golf facino humilha o INOCOOP
Zé Polvinho registra tem coxinha na porta
Pode me acionar que tem QSJ
Rosana Bronks lealdade primeiro
1 por amor 2 por dinheiro
De um lado as de 100 do outro as de 50
Fusão Leste Sul que tal representa
Em plena Mateo Bei de 900 Zera
Sentido Zona Sul a rapa me espera
Aqui ninguém quer fama e diz que diz
4 mil dolar já me faz feliz
Dinheiro city capital da Gozolândia
Malandro bom não humilha e nem desanda
Liga o outro Mano o da mil e cem
Ne pagando no Capão é que mais tem
De Audi ou Citroen, já disse o Brown
Um role pela fundão é fundamental
Quem é quem, diz que diz
Buchicho não me faz feliz
Vida alheia, ora bola
Minha cota eu quero em dólar
Na periferia tem uma pá com disposição
Atrás do cifrão só vai quem tem o dom
Jogue a moeda pra ver no que vai dar
Coroa negativa, a cara é comigo
Com ele lá em cima eu não estou sozinho
Deus está trilhando, pode crer, o meu caminho
Vou que vou, vou pra decidir
Estou de pé, não vou cair
Mas que nada eu vou fazer minha caminhada
Encontrar com os irmãos na quebrada
Satisfeito, sou sujeito
Com respeito, bater no peito
Um sete um furado aqui não compra ninguém
Corromper a minha mente aí, nem vem
Sai fora, nem cola (ih)
Demora
You might also like1 por amor 2 por dinheiro
Na selva é assim e você vale o que tem
Vale o que tem na mão, na mão
1 por amor 2 por dinheiro
Na selva é assim e você vale o que tem
Vale o que tem na mão, na mão
1 por amor 2 por dinheiro
Na selva é assim e você vale o que tem
Vale o que tem na mão, na mão
Vida loka é só quem é
Guerreiro de fé
Todo amor pros parceiro
Liberdade e dinheiro
Quem é quem, diz que diz
Buchicho não me faz feliz
Vida alheia, ora bola
Minha cota eu quero em dólar
Você vale o que tem (minha cara)
Você vale o que tem (minha cara)
Você vale o que tem
Você vale o que tem
Nós é mato uhu-uhuEmbed",1-por-amor-2-por-dinheiro,Racionais-mcs
37,NadaComoUmDiaApósoOutroDiaDisco2RiDepois,"De Volta à Cena Lyrics[Letra de ""De Volta à Cena""]

[Intro]
É tru, Racionais tá aí de novo, morô?
E os caras é mili anos na parada (pode crê)
E o caras representa a favela do começo ao fim
Mais aí, é muita treta hein
É idéia de mil grau no bagulho

[Verso: Edi Rock]
Racionais roubando a cena
Realidade é a palavra, atitude é o meu o lema
Esquema feito a justiça está com nóiz
Lei da periferia irmão, ouça a minha voz
Meu rap é linha de frente dessa guerrilha
Faça o que puder, vier siga minha estreita trilha
(Na picadilha a matilha está a solta)
Ideia de mil grau e o veneno escorrendo da boca
(Nego, a vida é loka) cruel e sangrenta
Só muito pior, sem dó, marginal e violenta
O sangue esquenta, Ei Éder, quero ver
(Edinho liga o Marquinhos pra fazer o chão tremer)
Pode crê, não sou aquele que via satélite te seduz
(Porque) bala de PT não faz sinal da cruz
Nem muito menos tô aqui pra fazer média
Não sou aquele que pega carona na tragédia
Vejo de perto a viúva da dor
Pisando em caco de vidro, filha do rancor
Convivendo com o divino e o diabólico
Entre os crentes, os espíritas, o crime e os católicos
Tristes, eufóricos, tranquilos e melancólicos
O engatilhado sofrimento é metabólico
Soldado da paz, mas treinado para guerra
Meu arsenal é o seu calvário nas ruas da serraYou might also likeEmbed",de-volta-a-cena,Racionais-mcs
38,NadaComoUmDiaApósoOutroDiaDisco2RiDepois,"Otus 500 Lyrics[Letra de ""Otus 500""]

[Intro: Scratches]
""500 anos... tudo igual...
América... justiça...
500 anos depois... tudo igual...
Justiça... paz...
500 anos...
Jesus está por vir mas o diabo já está aqui...""

[Verso: Edi Rock]
500 anos, o Brasil é uma vergonha
Polícia fuma pedra moleque fuma maconha
Dona cegonha entrega mais uma princesa
Mais uma boca com certeza que vem à mesa
Onde cabe um, dois, cabe três
A dificuldade entra em cena outra vez
Enquanto isso playboy forgado anda assustado
Deve tá pagando algum erro do passado
Assalto, sequestro é só o começo
A senzala avisou, Mauricinho hoje paga o preço
Sem adereço, desconto ou perdão
Quem tem vida decente não precisa usar oitão
É doutor, seu Titanic afundou
Quem ontem era a caça hoje pá é o predador
Que cansou de ser ingênuo humilde e pacato
Encapuçou virou bandido e não deixa barato
Se atacou e foi pra rua buscar
Confere se não tá abrindo o seu frigobar
Na sala de estar assistindo a um DVD
Com sua esposa de refém esperando você
Quer sair do compensado e ir pra uma mansão
Com piscina digna de um patrão
Com vários cães de guarda, rottweiler
E dama socialite de favela estilo Cáli
Quer jantar com cristal e talheres de prata
Comprar 20 pares de sapato e gravata
Possuir igual você, tem um Fokker 100
Tem também na garagem dois Mercedes-Benz
Voar de helicóptero à beira mar
Armani e Hugo-Boss no guarda-roupa pra variar
Presentear a mulher com brilhantes
Dar gargantilha 18 pra amante
Como agravante a ostentação
O que ele sonha ate então tá na sua mão
De desempregado a homem de negócio
Pulou o muro já era, agora é o novo sócioYou might also like1Embed",otus-500,Racionais-mcs
39,NadaComoUmDiaApósoOutroDiaDisco2RiDepois,"Crime Vai e Vem Lyrics[Letra de ""Crime Vai e Vem""]

[Introdução]
- Ô, mano, cê viu o tanto de polícia que tem na área, aí, mano?
- É, então, tá embaçado o morro, certo, mano? Então, no fim de ano, ir pra cadeia não vira...
- Ó quem tá chegando aí, irmão
- E aí, Cláudio, firmeza?
- E aí, firmeza, família? Como é que tá o morro?
- Então, o morro tá daquele jeito, certo, mano? Então, tem que ficar ligeiro, porque tá cheio de polícia, cheio de ganso
- Então, aí, tô descabelado, mano, vim pra me levantar de novo
- Então, vamo colar aí?
[Verso 1: Edi Rock]
Tá vendo aquele truta parado ali
Bolando ideia com os mano na esquina?
É envolvido com crack, maconha e cocaína
Tirou cadeia, cumpriu a sua cota
Pagou o que devia, mas, agora, ele tá de volta
Saudades da quebrada, família
Coração amargurado pelo tempo perdido na ilha
Se levantar, agora, é só, nada mais importa
Louco é mato, tá cheio no morro, não falta
Esses anos aguardou, paciente
O limite é uma fronteira criada só pela mente
Conta com o que ficou, e, não, o que perdeu
Quem vive do passado é memória, museu
Dinheiro, segredo, palavra-chave
Manipula o mundo e articula a verdade
Compra o silêncio, monta a milícia,
Paga o sossego, compra a política
Aos olhos da sociedade, mais um bandido,
E a bandidagem paga o preço pela vida
Vida entre o ódio, a traição e o respeito
Entre a bala na agulha e uma faca cravada no peito
Daquele jeito, ninguém ali brinca com fogo
Perdedor não entra nesse jogo
É como num tabuleiro de xadrez:
Xeque-mate, vida ou morte, um, dois, três
Vê direito, para, pensa, nada a perder
O réu acusado já foi programado pra morrer
Quem se habilita a debater?
Quem cai na rede é peixe, não tem pra onde correr
You might also like[Refrão: Edi Rock]
E aí, o crime vai, o crime vem
A quebrada tá normal e eu tô, também
O movimento dá dinheiro, sem problema
O consumo tá em alta, como manda o sistema
O crime vai, o crime vem
A quebrada tá normal e eu tô, também
Onde há fogo, há fumaça
Onde chega a droga, é inevitável, embaça

[Verso 2: Edi Rock, Ice Blue]
Eu tô aqui, com uma nove na mão
Cercado de droga e muita disposição, ladrão
Fui rotulado pela sua sociedade
Um passo a mais pra ficar na criminalidade
O meu cotidiano é um teste de sobrevivência
Já tô na vida, então, paciência
Pra cadeia não quero, não volto nunca mais
Aí, truta, se for pra ser, eu quero é mais
Aqui é mó covil, ninho de serpentes
Tem que ser louco pra vir bater de frente
Minha coroa não pode passar veneno
Já é velha e meu moleque ainda é pequeno
Um irmão morreu, o outro se casou
Saiu dessa porra, firmeza, se jogou
Só eu fiquei fazendo tempo por aqui
Tentei evitar mas não consegui, aí
Se meu futuro estiver traçado
Eu vou até o fim só pra ver o resultado
Quero dinheiro e uma vida melhor
Antes que meu castelo se transforme em pó
Só, o vício da morte está à venda
Em cada rua, uma alma
Em cada alma, uma encomenda
O consumo pra alguns é uma ameaça
Vários desanda, vacila e vira caça
(Tem mano que dá várias narigada aqui
Cheira até umas hora) Deixa cair
É intensidade o tempo inteiro
Cartel latino, São Paulo ao Rio de Janeiro
Dá mó dinheiro, dólares, rato de sócio
Nesse ramo, são que nem abutre, nos negócios
A noite chega, a febre aumenta
Pode ser da paz ou curviana violenta
[Interlúdio]
- Então, vamo terminar de enrolar um bagulho, pra nóis fazer o rolê, irmão
-Firmeza, firmeza, mano
-Vai, vai, vai, vai, vai! Todo mundo, mão pra cabeça, mão pra cabeça! Cadê o bagulho, irmão?!
- Vai, que tá caguetado! Quem que é o Cláudio, aí?!
Vai, quem que é o Cláudio, aí, no bagulho?!

[Verso 3: Edi Rock, Ice Blue]
Tráfico não tranca mais segredo
São três horas da manhã
E pra alguns maluco ainda é cedo
Na esquina, na entrada da favela
Uma mula de campana, fumando na viela
(E aí, cadê o Cláudio?)
Aí, o Cláudio tá perdido
Foragido da quebrada
E deixou tudo comigo
Os ganso tá na febre
Mas flagrante é dinheiro
Eu tô ligeiro a todo instante, parceiro
Mês de agosto atravessa o inverno
Os anjos do céu guiam meus passos, andando no inferno
Será eterna a estrada do fim
Aí que tá, é vulnerável
Provável pra mim
Que seja assim:
Um ganha e outro perde
Enquanto um louco cheira, o demônio se diverte
(Assim que é, assim que tá...)

[Refrão]

[Verso 4: Edi Rock]
O pobre, o preto, no gueto, é sempre assim:
O tempo não para, a guerra não tem fim
O crime e a favela, é lado a lado
É que nem dois aliados, o isqueiro e o cigarro
Na viela, no beco, na rua sem saída
Na esquina da quebrada, continua, assim, na mesma vida
Rotina que, assim, vai e prossegue
Vitorioso é aquele que, se pá, consegue
Sobreviver e não deitar, crivado de bala
Igual na rua D, ensanguentado no meio da vala
Muita cautela ainda é pouco
Mano armado, traíra, andando que nem louco
Mano passando uns barato roubado
Jogo arriscado, mas quem tá preocupado?
Sujeito ou cuzão? Herói ou vilão?
Cada .40 na mente, diferente reação
Cada estrada, uma lição da própria vida
Cada caminho, um atalho, uma tentativa
A qualidade, aqui, são das piores
Vários maluco dando o sangue por dias melhores
Foi dado um golpe de estado cavernoso
A máquina do desemprego fabrica criminoso
De bombeta, tatuado, sem camisa
De bermudão, no pião, na mesma brisa
Formação de quadrilha conduz o crime
Fora da lei, eu sei, eu vejo filme
Las Vegas, o patrão gira a roleta
Controla tudo na ponta da caneta
Sentindo, na garganta, o amargo do fel
Com o crime organizado, na Torre de Babel
Inteligente é o que vai pra cama mais cedo
Com uma quadrada na cintura, não é mais segredo
Não tenha medo, então, por que você veio aqui?
É guerra fria e você tá bem no meio, aí
Fogo cruzado, lado norte
Só vagabundo, bandidagem, e a morte
Boa sorte1Embed",crime-vai-e-vem,Racionais-mcs
