,album,lyric,title,artist
0,HolocaustoUrbano,"Pânico Na Zona Sul LyricsLetra de ""Pânico Na Zona Sul"" com Racionais MC's

[Intro]
Edi Rock: Aqui é Racionais MC's, Ice Blue, Mano Brown, KL Jay e eu Edi Rock. E ai Mano Brown, certo?
Mano Brown: Certo não está né mano, e os inocentes quem os trará de volta?
Ice Blue: É... a nossa vida continua, e ai quem se importa?
Mano Brown: A sociedade sempre fecha as portas mesmo cara
Edi Rock: E aí, Ice Blue?
Ice Blue: Pânico!

[Verso 1: Mano Brown, Ice Blue]
Então quando o dia escurece
Só quem é de lá sabe o que acontece
Ao que me parece prevalece a ignorância
E nós estamos sós
Ninguém quer ouvir a nossa voz
Cheia de razões calibres em punho
Dificilmente um testemunho vai aparecer
E pode crer a verdade se omite
Pois quem garante o meu dia seguinte
Justiceiros são chamados por eles mesmos
Matam humilham e dão tiros a esmo
E a polícia não demonstra sequer vontade
De resolver ou apurar a verdade
Pois simplesmente é conveniente
E por que ajudariam se nos julgam deliquentes
E as ocorrências prosseguem sem problema nenhum
Continua-se o pânico na Zona Sul
[Refrão: Ice Blue (Sample)]
Pânico na Zona Sul
(Pânico)

[Verso 2: Mano Brown, Ice Blue]
Eu não sei se eles
Estão ou não autorizados
De decidir que é certo ou errado
Inocente ou culpado retrato falado
Não existe mais justiça ou estou enganado?
Se eu fosse citar o nome de todos que se foram
O meu tempo não daria pra falar (MAS)
Eu vou lembrar que ficou por isso mesmo
E então que segurança se tem em tal situação?
Quantos terão que sofrer pra se tomar providência
Ou vão dar mais algum tempo e assistir a sequência
E com certeza ignorar a procedência
O sensacionalismo pra eles é o máximo
Acabar com delinquentes eles acham ótimo
Desde que nenhum parente ou então é lógico
Seus próprios filhos sejam os próximos
E é por isso que nós estamos aqui
E ai mano Ice Blue
Pânico na Zona Sul!

[Refrão]
You might also like[Verso 3: Mano Brown, Ice Blue]
Racionais vão contar
A realidade das ruas
Que não media outras vidas
A minha e a sua
Viemos falar
Que pra mudar
Temos que parar de se acomodar
E acatar o que nos prejudica
O medo, sentimento em comum num lugar
Que parece sempre estar esquecido
Desconfiança insegurança mano
Pois já se tem a consciência do perigo
E ai?
Mal te conhecem consideram inimigo
E se você der o azar de apenas ser parecido
Eu te garanto que não vai ser divertido
Se julgam homens da lei
Mas à respeito eu não sei
Muito cuidado eu terei
(Scracth KLJay)
Eu não serei mais um porque estou esperto
Do que acontece Ice Blue
Pânico na Zona Sul

[Refrão]
[Verso 4: Mano Brown, Ice Blue]
Ei, Brown, você acha que o problema acabou?
Pelo contrário ele apenas começou
Não perceberam que agora se tornaram iguais
Se inverteram e também são marginais, mas
Terão que ser perseguidos e esclarecidos
Tudo e todos até o último indivíduo
Porém se nos querermos que as coisas mudem
Ei Brown qual será a nossa atitude?
A mudança estará em nossa consciência
Praticando nossos atos com coêrencia
E a consequência será o fim do próprio medo
Pois quem gosta de nós somos nós mesmos
Te cuide porque ninguém cuidará de você
Não entre nessa a toa
Não de motivo pra morrer
Honestidade nunca será demais
Sua moral não se ganha, se faz
Não somos donos da verdade
Porém não mentimos
Sentimos a necessidade de uma melhoria
A nossa filosofia é sempre transmitir
A realidade em si, Racionais MC's

[Refrão]

[Outro: Mano Brown]
Certo, certo... Então, irmão
Volte a atenção pra você mesmo
E pense como você tem vivido até hoje certo?
Quem gosta de você é você mesmo
Nós somos Racionais MCs
DJ KL Jay, Ice Blue, Edi Rock, e eu, Brown
Paz
PânicoEmbed",panico-na-zona-sul,Racionais-mcs
1,HolocaustoUrbano,"Beco Sem Saída Lyrics[Verso 1: Edi Rock]
Às vezes eu paro e reparo, fico a pensar
Qual seria meu destino senão cantar
Um rejeitado, perdido no mundo, é um bom exemplo
Irei fundo no assunto, fique atento
A sarjeta é um lar não muito confortável
O cheiro é ruim, insuportável
O viaduto é o reduto nas noites de frio
Onde muitos dormem, e outros morrem, ouviu?
(São chamados) de indigentes pela sociedade
A maioria negros, já não é segredo, nem novidade
Vivem como ratos jogados
Homens, mulheres, crianças
Vítimas de uma ingrata herança
A esperança é a primeira que morre
E sobrevive a cada dia a certeza da eterna miséria
O que se espera de um país decadente
Onde o sistema é duro, cruel, intransigente?
[Refrão](4X)
Beco sem saída

[Verso 2: Edi Rock]
Mas muitos não progridem porque na verdade assim querem
Ficam inertes, não se movem, não se mexem
Sabe por que se sujeitaram a essa situação?
Não pergunte pra mim, tire você a conclusão
Talvez a base disso tudo esteja em vocês mesmos
E a consequência é o descrédito de nós negros
Por culpa de você, que não se valoriza
Eu digo a verdade, você me ironiza
A conclusão da sociedade é a mesma
Que com frieza não analisa, generaliza
E só critica, o quadro não se altera e você
Ainda espera que o dia de amanhã será bem melhor
Você é manipulado, se finge de cego
Agir desse modo, acha que é o mais certo
Fica perdida a pergunta: de quem é a culpa?
Do poder, da mídia, minha ou sua?
As ruas refletem a face oculta
De um poema falso que sobrevive às nossas custas
A burguesia, conhecida como classe nobre
Tem nojo e odeia a todos nós negros pobres
Por outro lado, adoram nossa pobreza
Pois é dela que é feita sua maldita riqueza
You might also like[Refrão](2X)

[Interlúdio]
Edi Rock: É, meu mano KL Jay. O poder mente, ilude, e domina
A maioria da população, carente da educação e cultura e é dessa forma que eles querem que se proceda. Não é verdade?
KL Jay: É, pode crê!

[Verso 3: Edi Rock, KL Jay]
Nascem, crescem, morrem, passam desapercebidos
(E a saída é esta vida bandida que levam roubando
Matando, morrendo, entre si se acabando)
Ei mano, dê-nos ouvidos!
Os poderosos ignoram os direitos iguais
Desprezam e dizem que vivam como mendigos a mais
Não sou um mártir que um dia irá te salvar
No momento certo, você pode se condenar
Não jogamos a culpa em quem não tem culpa
Só falamos a verdade e a nossa parte você sabe de cor
Atravesse essa muralha imaginária
Em sua cabeça, sem ter medo de falhas
Se conseguiram derrubar uma muralha real de pedra
Você pode conseguir derrubar esta
Leia, ouça, escute, ache certo ou errado
Mas meu amigo, não fique parado
Se não isso tudo vai ser apenas um grito solitário
Em um porão fechado, tome cuidado
Não esqueça o grande ditado: cada um por si!
Siga concordando com tudo que eu digo, normal
Pois pra você parece mais um artigo, jornal
Esse é o meu ponto de vista, não sou um moralista
Deixe de ser egoísta, meu camarada, persista
É só uma questão: será que você é capaz de lutar?
É difícil, mas não custa nada tentar
[Outro: Edi Rock]
Ei cara, o sentido disto tudo está em você mesmo
Pare, pense, e acorde, antes que seja tarde demais
O dia de amanhã te espera, morô?
Edi Rock, KL Jay, Racionais!

[Refrão]
Beco sem saída! (Pode crê, né não?)
Beco sem saída! (Aí mano)
Beco sem saída! (Certo !)
Beco...beco...beco sem saída, beco sem saída, beco sem saída!1Embed",beco-sem-saida,Racionais-mcs
2,HolocaustoUrbano,"Hey Boy Lyrics[Intro]
Ice Blue: Hey boy! hey boy! Dá um tempo ai, cola ai! Pera ai!
Mano Brown: Que é mano? Que esse otário tá fazendo aqui?Ai dá um tempo ai, chega ai...
Boy: Que foi bicho!?
Mano Brown: Lembra de mim mano?
Boy: Não...
Mano Brown: Então vamo trocar uma ideia nós dois agora...

[Verso 1: Mano Brown, Ice Blue]
Hey boy o que você está fazendo aqui
Meu bairro não é seu lugar e você vai se ferir
Você não sabe onde está, caiu num ninho de cobra
E eu acho que vai ter que se explicar
Pra sair não vai ser fácil
A vida aqui é dura
Dura é a lei do mais forte
Onde a miséria não tem cura
E o remédio mais provável é a morte
Continuar vivo é uma batalha
Isso é se eu não cometer falha
E se eu não fosse esperto tiravam tudo de mim
Arrancavam minha pele, minha vida, enfim
Tenho que me desdobrar pra não puxarem meu tapete
E estar sempre quente
Pra não ser surpreendido de repente
Se eu vacilo trocam minha vaga
O que você fizer aqui mesmo você paga
A pouca grana que eu tenho não dá pro próprio consumo
Enquanto nós conversamos, a polícia apreende e finge
A marginalidade cresce sem precedência
Conforme o tempo passa, aumentar é a tendência
E muitas vezes não tem jeito, a solução é roubar
E seus pais acham que a cadeia é nosso lugar
O sistema é a causa e nós somos a consequência  maior
Da chamada violência
Porque na real com nossa vida ninguém se importa
E ainda querem que sejamos patriotas?
[Refrão]
Hey boy

[Verso 2: Mano Brow, Ice Blue]
Isso tudo é verdade mas não tenha dó de mim
Porque esse é meu lugar, mas eu o quero mesmo assim
Mesmo sendo o lado esquecido da cidade
E bode expiatório de toda e qualquer mediocridade
A sociedade já não sabe o que fazer
Se vão interferir ou deixar acontecer
Mas por sermos todos pobres os tachados somos nós
Só por ser conveniente (hey boy)
Pense bem se não faz sentido
Se hoje em dia eu fosse um cara tão bem sucedido
Como você é chamado de superior
E tem todos na mão e tudo a seu favor
Sempre teve tudo e não fez nada por ninguém
Se as coisas andam mal é sua culpa também
Seus pais dão as costas para o mundo que os cercam
Ficam com o maior melhor e pra nós nada resta
Você gasta fortunas se vestindo em etiqueta
E na sarjeta é as crianças, futuros homens
Quase não comem, morrem de fome
Com frio e com medo , já não é segredo
E as drogas consomem
Sinta o contraste e só me dê razão
Não fale mais nada porque
Vai ser em vão
You might also like[Refrão]

[Verso 3: Mano Brown]
Você faz parte daqueles que colaboram
Para que a vida de muitas pessoas seja tão ruim
Acha que sozinho não vai resolver
Mas é por muitos pensarem assim como você
Que a situação vai de mal a pior
E como sempre você pensa em si só
Seu egoísmo, ambição e desprezo
Serão os argumentos pra matar você mesmo
Então eu digo: (hey boy)
Não fique surpreso
Se o ridículo e odioso, círculo vicioso
Sistema que você faz parte
O transformar num criminoso e doloroso
Será ser rejeitado, humilhado
Considerado um marginal
Descriminado, você vai saber
Sentir na pele como dói
Então aprenda a lição
(Hey boy)

[Outro]
Mano Brown: Aí boy sai andando ai certo? Eu tenho todos os motivos, mas nem por isso eu vou te roubar, morô?
Sai andando
Ice Blue: Vai caminha, mano! Não tem nada pra você aqui não, seu otário! Vai embora, sai fora!
Mano Brown: E não pisa mais aqui hein!Embed",hey-boy,Racionais-mcs
3,HolocaustoUrbano,"Mulheres Vulgares Lyrics[Intro]
Edi Rock: Alô?
Mano Brown: E aí, Edi Rock, certo?
Edi Rock: Ô Brown, e aí, certo mano? Tava esperando cê me ligar mesmo
Mano Brown: E aí, qual é a nova irmão?
Edi Rock: É sobre mulher e tal
Mano Brown: Mulher? Que tipo de mulher?
Edi Rock: Se liga aí

[Verso 1: Edi Rock]
Derivada de uma sociedade feminista
Que considera e dizem que somos todos machistas
Não quer ser considerada símbolo sexual
Lutam pra chegar ao poder, provar a sua moral
Numa relação na qual
Não admite ser subjugada, passada pra trás
Exigem direitos iguais, certo mano?
(E do outro lado da moeda, como é que é?)
Pode crê
Pra ela, dinheiro é o mais importante
Seu jeito vulgar, suas idéias são repugnantes
É uma cretina que se mostra nua como objeto
É uma inútil que ganha dinheiro fazendo sexo
No quarto, motel, ou telas de cinema
Ela é mais uma figura viva, obscena
Luta por um lugar ao sol
Fama, dinheiro com rei de futebol
No qual quer se encostar em um magnata
Que comande seus passos de terno e gravata (otário)
Quer ser a peça centra em qualquer local
Que a julguem total
Quer ser manchete de jornal
Somos Racionais, diferentes, e não iguais
Mulheres vulgares, uma noite e nada mais
[Refrão: Edi Rock]
Mulheres vulgares
Mulheres vulgares, uma noite e nada mais

[Interlúdio]
Edi Rock: E aí, Brown? Cola aí, e tal
Fala aí tua parte, e tal
Mano Brown: Ô, falo sim
Peraí, peraí
É bonita, gostosa e sensual
Seu batom e a maquiagem a tornam banal
Ser a mau, fatal, legal, ruim
Ela não se importa, só quer dinheiro, enfim

[Verso 2: Edi Rock]
Envolve qualquer um com seu ar de ingenuidade
Na verdade, por trás mora a mais pura mediocridade (pode crer)
Te domina com seu jeito promíscuo de ser
Como se troca de roupa, ela te troca por outro (né não?)
Muitos a querem para sempre
Mas eu a quero só por uma noite, você me entende?
Gosta de homens da alta sociedade
Até os grandes traficantes entram em rotatividade
Mestiça, negra ou branca
Uma de suas únicas qualidades: a ganância
A impressão que se ganha é de decência
Quando se trata de dinheiro, sexo, se torna indolência
Fica perdida no ar a pergunta:
Qual a pior atitude de uma prostituta? (e eu sei, mano?)
Se vender por necessidade ou por ambição?
Tire você a conclusão
You might also like[Refrão]

[Verso 3: Edi Rock]
Então, irmão, é de coração
Abra os olhos e veja a razão
Querer, poder, ter
Não é pra você se proteger, prever antes de acontecer
E hoje ela diz: ""Que cara vou dormir?""
Com seu rosto bonito é fácil atrair, e daí?
Pra sair não precisa insistir
É só ser alguém e estalar os dedos assim
Francamente ela se julga capaz
De dominar a qualquer idiota que tenha conforto pra dar (não eu)
Não importa a sua cor, não importa a sua ideia
Apenas dinheiro esnobando, jogando pela janela
Não entre nessa cilada
Fique esperto com o mundo e atento com tudo e com nada
Mulheres só querem, preferem o que as favorecem
Dinheiro, ibope, te esquecem se não os tiverem
Somos Racionais, diferentes, e não iguais
Mulheres vulgares (o quê?) uma noite e nada mais!

[Refrão]

[Outro]
Mano Brown: Gostei, gostei É mano, tem uns caras que ficam iludidos com essas mina aí, capa de revista, pôster, viagem pra Europa, mas por baixo mano, mó sujeira! Vai nessa, morô?
Edi Rock: E isso aí, mano. Até a próxima Brown...Embed",mulheres-vulgares,Racionais-mcs
4,HolocaustoUrbano,"Racistas Otários Lyrics[Verso 1: Mano Brown & Ice Blue]
Racistas otários, nos deixem em paz
Pois as famílias pobres não aguentam mais
Pois todos sabem e elas temem
A indiferença por gente carente que se tem
E eles veem com toda autoridade o preconceito eterno
E de repente o nosso espaço se transforma
Num verdadeiro inferno e reclamar direitos de que forma
Se somos meros cidadãos e eles o sistema?
E a nossa desinformação é o maior problema
Mas mesmo assim, enfim, queremos ser iguais
Racistas otários, nos deixem em paz
[Refrão]
Racistas otários, nos deixem em paz
Racistas otários, nos deixem em paz
Racistas otários, nos deixem em paz
Racistas otários, nos deixem em paz

[Verso 2: Mano Brown & Ice Blue]
Justiça, em nome disso eles são pagos
Mas a noção que se tem é limitada e eu sei
Que a lei é implacável com os oprimidos
Tornam bandidos os que eram pessoas de bem
Pois já é tão claro que é mais fácil dizer
Que eles são os certos e o culpado é você
Se existe ou não a culpa, ninguém se preocupa
Pois em todo caso haverá sempre uma desculpa
O abuso é demais pra eles tanto faz
Não passará de simples fotos nos jornais
Pois gente negra e carente não muito influente
E pouco frequente nas colunas sociais
Então eu digo: Meu rapaz, esteja constante
Ou abrirão o seu bolso e jogarão um flagrante
Num presídio qualquer será um irmão a mais
Racistas otários, nos deixem em paz

[Refrão]
Racistas otários, nos deixem em paz
Racistas otários, nos deixem em paz
Racistas otários, nos deixem em paz
You might also like[Sample]
(Pois a lei é suja e segue mal interpretada)

[Verso 3: Mano Brown, Ice Blue & KL Jay]
Então a velha história outra vez se repete
Por um sistema falido como marionetes
Nós somos movidos e há muito tempo tem sido assim
Nos empurram à incerteza e ao crime enfim
Porque aí sim, certamente estão se preparando
Com carros e armas nos esperando
E os poderosos bem seguros, observando
O rotineiro holocausto urbano
O sistema é racista, cruel
Levam cada vez mais irmãos aos bancos dos réus
Os sociólogos preferem ser imparciais
E dizem ser financeiro o nosso dilema
Mas se analisarmos bem mais você descobre
Que negro e branco pobre se parecem, mas não são iguais
Crianças vão nascendo em condições bem precárias
Se desenvolvendo sem a paz necessária
São filhos de pais sofridos e por esse mesmo motivo
Nível de informação é um tanto reduzido
Não! É um absurdo
São pessoas assim que se fodem com tudo
E que no dia a dia vive tensa e insegura
E sofre as covardias humilhações torturas
A conclusão é sua, KL Jay
Se julgam homens da lei, mas a respeito eu não sei
Porém direi para vocês, irmãos
Nossos motivos pra lutar ainda são os mesmos
O preconceito e o desprezo ainda são iguais
Nós somos negros, também temos nossos ideais
Racistas otários nos deixem em paz
[Refrão]
Racistas otários, nos deixem em paz
Racistas otários, nos deixem em paz
Racistas otários, nos deixem em paz
Racistas otários, nos deixem em paz

[Verso 4: Mano Brown, Ice Blue]
Os poderosos são covardes desleais
Espancam negros nas ruas por motivos banais
E nossos ancestrais, por igualdade lutaram
Se rebelaram, morreram, e hoje o que fazemos?
Assistimos a tudo de braços cruzados
Até parece que nem somos nós os prejudicados
Enquanto você sossegado foge da questão
Eles circulam na rua com uma descrição
Que é parecida com a sua, cabelo cor e feição
Será que eles vêem em nós um marginal padrão?
50 anos agora se completam
Da lei anti-racismo na constituição
Infalível na teoria, inútil no dia a dia
Então que fodam-se eles com sua demagogia
No meu pais o preconceito é eficaz
Te cumprimentam na frente e te dão um tiro por trás

[Interlúdio]
O Brasil é um pais de clima tropical
Onde as raças se misturam naturalmente
E não há preconceito racial
Ha, ha, ha, ha, ha, ha, ha...

[Saída: Mano Brown]
Nossos motivos pra lutar ainda são os mesmos
O preconceito e o desprezo ainda são iguais
Nós somos negros também temos nossos ideais
Racistas otários nos deixem em paz!Embed",racistas-otarios,Racionais-mcs
5,HolocaustoUrbano,"Tempos Difíceis Lyrics[Verso 1: Edi Rock]
Eu vou dizer porque o mundo é assim
Poderia ser melhor mas ele é tão ruim
Tempos difíceis, está difícil viver
Procuramos um motivo vivo, mas ninguém sabe dizer
Milhões de pessoas boas morrem de fome
E o culpado, condenado disto é o próprio homem
O domínio está em mão de poderosos, mentirosos
Que não querem saber
Porcos, nos querem todos mortos
Pessoas trabalham o mês inteiro
Se cansam, se esgotam, por pouco dinheiro
Enquanto tantos outros nada trabalham
Só atrapalham e ainda falam
Que as coisas melhoraram
Ao invés de fazerem algo necessário
Ao contrário, iludem, enganam otários
Prometem 100%, prometem mentindo, fingindo, traindo
E na verdade, de nós estão rindo
[Refrão: Edi Rock]
Tempos... Tempos difíceis!
(4X)

[Verso 2: Edi Rock]
Tanto dinheiro jogado fora
Sendo gasto por eles em poucas horas
Tanto dinheiro desperdiçado
E não pensam no sofrimento de um menor abandonado
O mundo está cheio, cheio de miséria
Isto prova que está próximo o fim de mais uma era
O homem construiu, criou, armas nucleares
E o aperto de um botão, o mundo irá pelos ares
Extra, publicam, publicam extra os jornais
Corrupção e violência aumentam mais e mais
Com quais, sexo e droga se tornaram algo vulgar
E com isso, vem a AIDS pra todos liquidar
A morte, enfim. Vem destruição, causam terrorismo
E cada vez mais o mundo afunda num abismo

[Refrão]

[Verso 3: Edi Rock]
Menores carentes se tornam delinquentes
E ninguém nada faz pelo futuro dessa gente
A saída é essa vida bandida que levam
Roubando, matando, morrendo entre si se acabando
Enquanto homens de poder fingem não ver
Não querem saber, faz o que bem entender
E assim... aumenta a violência
Não somos nós os culpados dessa consequência?
Destruíram a natureza e o que puseram em seu lugar
Jamais terá igual beleza
Poluíram o ar e o tornaram impuro
E o futuro eu pergunto, confuso: Como será?
Agora em quatro segundos irei dizer um ditado:
Tudo que se faz de errado aqui mesmo será pago
O meu nome é Edi Rock, um rapper e não um otário
Se algo não fizermos, estaremos acabados
You might also like[Outro: Edi Rock]
KL Jay! Tempos difíceis!
Tempos difíceis!Embed",tempos-dificeis,Racionais-mcs
6,RaioXdoBrasil,"Introdução Lyrics[Introdução]
1993
Fudidamente voltando
Racionais
Usando e abusando da nossa liberdade de expressão
Um dos poucos direitos que o jovem negro ainda tem nesse país
Você está entrando no mundo da informação, autoconhecimento, denuncia e diversão
Esse é o Raio-X do Brasil, seja bem-vindoYou might also likeEmbed",introducao,Racionais-mcs
