,album,lyric,title,artist
13,RaioXdoBrasil,"Agradecimentos Lyrics[Edi Rock]
A vocês que direto ou indiretamente contribuíram para a realização desse projeto
Aos amigos do Racionais, muito obrigado

Primeiramente muito obrigado a Deus, minha grande mãe, meu grande pai, meus parentes, tios, primos e primas, sem eles seria difícil encarar essa batalha e tal
Aos chegados, Val, Bel, Sérgio e família
Ao Vado, grande Vado
Aos manos da área, território Jaçanã e Companhia Jova
Pode crer, Alberto filho da Dona Léo, obrigado pela atenção
A Vila Mazzei, grande Mazzei
Aí Jó, aquele abraço, pode crer
Panão Capoeira, Nei, Luís, Zé Hamilton, Richard
Aí Vila Sapo, aquele grande abraço
Dona Maria, irmãos do Kléber, Organização Gueto
Alô Bebê e Fátima Black Center, um grande abraço, muito obrigado por tudo
Manos daqui, Reginaldo de Cebola, Eduardo, Cláudio um grande abraço
E a todos da 24 de Maio, que Deus abençoe
[Mano Brown]
Dona Ana minha mãe, Eliane minha namorada, muito obrigado
Todo pessoal do Jardim Hevana, tô de olho em vocês hein
Kiko, Carlinhos, estejam em paz
Cosa Nostra, Rádio Transa Black
Rogério esteja em paz, muito obrigado
Pessoal da área, Dinho, Fubá, muito obrigado, é isso aí
Rapaziada do basquete que frequenta o Levir nos fins de semana, é isso aí, como é que é?
Fabinho, bruto sabe sambar
E aí Neto, toda rapaziada do Negritude Júnior, muito obrigado
Ivan, Grupo Realidade, que o samba não pode parar, pode crer
À toda comunidade da rima, Marcão, Rico, Igor, Marcelo, FNR, Face Negra, DMN, Projeto Rappers, muito obrigado
Sharylaine, DJ Qap
Personalidade Negra, Negros Para o Futuro, Conceito de Rua
E aê Capão Redondo, como é que é?
MC Diwcy, Dmau, Vítima Fatal
Lei de Rap, é isso aí, muito obrigado
Congratulações finais aos atletas: Cafu do São Paulo, Almir do Santos, Viola do Corinthians e Dener da Portuguesa, é isso aí

[Ice Blue]
Agradeço a minha família, aos meus manos de fé
Chico, Ricardo, Adailton, Lô, Dão, Ivan Pessoa, muito obrigado
A outros que se foram: Bola e Macumba, Deus que os tenha
Aí área, Nildo, Paulinho, Lambari, Santos, Florisvaldo, Josué, Tuta, Júlio, Mamute, Júlia, Tony, Jurandir, Claudeir, muito obrigado
Aos meus primos: Di, Bira, Marcão, Joca, Marivaldo, Cavalo, Sargento, Júlio, Ronaldo, Gordinho
Ao meu pai e minha mãe espiritual
Olorum modupé
Aos rappers, muito obrigado
Thaíde, Pepeu, Júnior, Comando D.M.C, M.T. Bronks, Sampa Crew
Ao Duda, Kaká, Barata, Beethoven, o Alfa, Luís Inário, Tubarão, Silvinho, Luizinho, ao pessoal da Zimbabwe, Willian, Zé Luís, Serafim, Tadeu, Pica-Pau, Vira-Lata, muito obrigado
Agradecimentos especiais: Nenê, Arthur e Kiko que participaram desse disco
Ao Paulo Cabelo, Milton Sais, ao DJ Cri, ao Nílton e ao Vander
Ao Silvão do Jardim Lídia, muito obrigado
Crédito a Tim Maia pela música ""Ela Partiu""
Agradeço a Deus, Alá, Oxalá e a todos os Orixás
Olorum modupé axé, axé, axé, axé, axéYou might also likeEmbed",agradecimentos,Racionais-mcs
14,SobrevivendonoInferno,"Jorge da Capadócia Lyrics[Letra de ""Jorge da Capadócia"" com Jorge Ben Jor]

[Intro]
Ogunhê!

[Verso]
Jorge sentou praça na cavalaria
E eu estou feliz porque eu também sou da sua companhia
Eu estou vestido com as roupas e as armas de Jorge
Para que meus inimigos tenham pés e não me alcancem
Para que meus inimigos tenham mãos e não me toquem
Para que meus inimigos tenham olhos e não me vejam
E nem mesmo em pensamento eles possam ter para me fazerem mal
Armas de fogo meu corpo não alcançarão
Facas e espadas se quebrem, se quebrem sem o meu corpo tocar
Cordas e correntes arrebentem sem o meu corpo amarrar
Pois eu estou vestido com as roupas e as armas de Jorge
Jorge é de Capadócia, salve, Jorge, salve, Jorge
Jorge é de Capadócia, salve, Jorge, salve, Jorge
Jorge é de Capadócia, salve, Jorge, salve, JorgeYou might also like4Embed",jorge-da-capadocia,Racionais-mcs
15,SobrevivendonoInferno,"Genesis Lyrics[Letra de ""Genesis""]

[Verso: Mano Brown]
Deus fez o mar, as árvore, as criança, o amor
O homem me deu a favela, o crack, a trairagem
As arma, as bebida, as puta
Eu? Eu tenho uma Bíblia véia
Uma pistola automática e um sentimento de revolta
Eu tô tentando sobreviver no infernoYou might also likeEmbed",genesis,Racionais-mcs
16,SobrevivendonoInferno,"Capítulo 4, Versículo 3 Lyrics[Letra de ""Capítulo 4, Versículo 3"" com Primo Preto]

[Intro: Primo Preto]
60% dos jovens de periferia sem antecedentes criminais
Já sofreram violência policial
A cada quatro pessoas mortas pela polícia, três são negras
Nas universidades brasileiras, apenas 2% dos alunos são negros
A cada quatro horas, um jovem negro morre violentamente
Em São Paulo
Aqui quem fala é Primo Preto, mais um sobrevivente
[Verso 1: Mano Brown]
Minha intenção é ruim, esvazia o lugar
Eu tô em cima, eu tô a fim, um, dois pra atirar
Eu sou bem pior do que você tá vendo
Preto aqui não tem dó, é 100% veneno
A primeira faz ""bum"" a segunda faz ""tá""
Eu tenho uma missão e não vou parar
Meu estilo é pesado e faz tremer o chão
Minha palavra vale um tiro, eu tenho muita munição
Na queda ou na ascensão minha atitude vai além
E tenho disposição pro mal e pro bem
Talvez eu seja um sádico, um anjo, um mágico
Juiz ou réu, um bandido do céu
Malandro ou otário, padre sanguinário
Franco atirador, se for necessário
Revolucionário, insano ou marginal
Antigo e moderno, imortal, fronteira do céu com o inferno
Astral imprevisível, como um ataque cardíaco no verso
Violentamente pacífico, verídico
Vim pra sabotar seu raciocínio
Vim pra abalar seu sistema nervoso e sanguíneo
Pra mim ainda é pouco, Brown cachorro louco
Número um guia terrorista da periferia
Uni-duni-tê o que eu tenho pra você
Um rap venenoso ou uma rajada de pt
E a profecia se fez como previsto
1997 depois de Cristo
A fúria negra ressuscita outra vez
Racionais, capítulo quatro, versículo três
You might also like[Ponte]
Aleluia, aleluia
Racionais no ar, filha da puta
Pá, pá, pá

[Verso 2: Mano Brown & Ice Blue]
Faz frio em São Paulo, pra mim tá sempre bom
Eu tô na rua de bombeta e moletom
Dim dim dom, rap é o som que emana do Opala marrom
E aí, chama o Guilherme, chama o Fanho, chama o Dinho
E o Di? Marquinho, chama o Éder, vamo aí
Se os outros mano vêm pela ordem, tudo bem, melhor
Quem é quem no bilhar, no dominó
Colou dois mano, um acenou pra mim
De jaco de cetim, de tênis, calça jeans
Ei, Brown, sai fora, nem vai, nem cola
Não vale a pena dar ideia nesse tipo aí
Ontem à noite eu vi na beira do asfalto
Tragando a morte, soprando a vida pro alto
Ó os cara só o pó, pele e osso
No fundo do poço, mó flagrante no bolso
Veja bem ninguém é mais que ninguém
Veja bem, veja bem e eles são nossos irmãos também
Mas de cocaína e crack, whisky e conhaque
Os mano morre rapidinho, sem lugar de destaque
Mas quem sou eu pra falar de quem cheira ou quem fuma?
Nem dá, nunca te dei porra nenhuma
Você fuma o que vem, entope o nariz
Bebe tudo que vê, faça o diabo feliz
Você vai terminar tipo o outro mano lá
Que era um preto tipo A ninguém tava numa
Mó estilo de calça Calvin Klein, tênis Puma, é
Um jeito humilde de ser, no trampo e no rolê
Curtia um funk jogava uma bola
Buscava a preta dele no portão da escola
Exemplo pra nós, mó moral, mó ibope
Mas começou a colar com os branquinho do shopping (Aí já era)
Ih, mano, outra vida, outro pique
Só mina de elite, balada, vários drinques
Puta de boutique, toda aquela porra
Sexo sem limite, Sodoma e Gomorra
Faz uns nove anos
Tem uns quinze dias atrás eu vi o mano
'Cê tem que ver
Pedindo cigarro pros tiozinho no ponto
Dente tudo zuado
Bolso sem nenhum conto
O cara cheira mal, as tias sente medo
Muito loco de sei lá o quê, logo cedo
Agora não oferece mais perigo
Viciado, doente, fudido, inofensivo
Um dia um PM negro veio embaçar
E disse pra eu me pôr no meu lugar
Eu vejo um mano nessas condições, não dá
Será assim que eu deveria estar?
Irmão, o demônio fode tudo ao seu redor
Pelo rádio, jornal, revista e outdoor
Te oferece dinheiro, conversa com calma
Contamina seu caráter, rouba sua alma
Depois te joga na merda, sozinho
É, transforma um preto ""tipo A"" num neguinho
Minha palavra alivia sua dor, ilumina minha alma
Louvado seja o meu senhor
Que não deixa o mano aqui desandar, ah
E nem sentar o dedo em nenhum pilantra
Mas que nenhum filha da puta ignore a minha lei
Racionais, capítulo quatro, versículo três
[Ponte]
Aleluia, aleluia
Racionais no ar, filha da puta
Pá, pá, pá

[Verso 3: Edi Rock, Mano Brown]
Quatro minutos se passaram e ninguém viu
O monstro que nasceu em algum lugar do Brasil
Talvez o mano que trampa debaixo do carro sujo de óleo
Que enquadra o carro forte na febre com o sangue nos olhos
O mano que entrega envelope o dia inteiro no sol
Ou o que vende chocolate de farol em farol
Talvez o cara que defende o pobre no tribunal
Ou o que procura vida nova na condicional
Alguém no quarto de madeira, lendo à luz de vela
Ouvindo um rádio velho no fundo de uma cela
Ou o da família real de negro, como eu sou
O príncipe guerreiro que defende o gol
E eu não mudo, mas eu não me iludo
Os mano cu de burro tem, eu sei de tudo
Em troca de dinheiro e um carro bom
Tem mano que rebola e usa até batom
Vários patrícios falam merda pra todo mundo rir (haha)
Pra ver branquinho aplaudir
É, na sua área tem fulano até pior
Cada um cada um, você se sente só
Tem mano que te aponta uma pistola e fala sério
Explode sua cara por um toca-fita velho
Click, plau plau plau e acabou, sem dó e sem dor
Foda-se sua cor, limpa o sangue com a camisa
E mande se foder, você sabe por quê, pra onde vai, pra quê
Vai de bar em bar, de esquina em esquina, pega cinquenta conto
Troca por cocaína, enfim, o filme acabou pra você
A bala não é de festim, aqui não tem dublê
Para os mano da Baixada Fluminense à Ceilândia
Eu sei, as ruas não são como a Disneylândia
De Guaianases ao extremo sul de Santo Amaro
Ser um preto tipo A custa caro, é foda
Foda é assistir a propaganda e ver
Não dá pra ter aquilo pra você
Playboy forgado de brinco, um trouxa
Roubado dentro do carro na avenida Rebouças
Correntinha das moça, as madame de bolsa
Dinheiro, não tive pai, não sou herdeiro
Se eu fosse aquele cara que se humilha no sinal
Por menos de um real minha chance era pouca
Mas se eu fosse aquele moleque de touca
Que engatilha e enfia o cano dentro da sua boca
De quebrada sem roupa, você e sua mina
Um, dois, nem me viu, já sumi na neblina
Mas não, permaneço vivo; prossigo a mística
Vinte e sete anos contrariando a estatística
Seu comercial de TV não me engana
Eu não preciso de status nem fama
Seu carro e sua grana já não me seduz
E nem a sua puta de olhos azuis
Eu sou apenas um rapaz latino-americano
Apoiado por mais de cinquenta mil manos
Efeito colateral que o seu sistema fez
Racionais, capítulo quatro, versículo três11Embed",capitulo-4-versiculo-3,Racionais-mcs
17,SobrevivendonoInferno,"Tô Ouvindo Alguém Me Chamar LyricsLetra de ""Tô Ouvindo Alguém Me Chamar"" com Racionais MC's

[Produzido por KL Jay]

[Verso 1: Mano Brown]
(Aí mano, o Guina mandou isso aqui pra você)
Tô ouvindo alguém gritar meu nome
Parece um mano meu, é voz de homem
Eu não consigo ver quem me chama
É tipo a voz do Guina
Não, não, não, o Guina tá em cana
Será? Ouvi dizer que morreu, sei lá
Última vez que eu o vi, eu lembro até que eu não quis ir, ele foi
Parceria forte aqui era nós dois
Louco, louco, louco e como era
Cheirava pra caralho, (vixe) sem miséria
Doido ponta firme
Foi professor no crime
Também maior sangue frio, não dava boi pra ninguém (Hamm...)
Puta aquele mano era foda
Só moto nervosa
Só mina da hora
Só roupa da moda
Deu uma pá de blusa pra mim
Naquela fita na butique do Itaim
Mas sem essa de sermão, mano, eu também quero ser assim
Vida de ladrão, não é tão ruim
Pensei, entrei, no outro assalto pulei, pronto
Aí o Guina deu mó ponto
[Interlúdio]
- Aí é um assalto, todo mundo pro chão, pro chão!
- Aí filho da puta, aqui ninguém tá de brincadeira não!
- Mais eu ofereço o cofre mano, o cofre, o cofre!
- Vamo lá que o bicho vai pegar!

[Verso 2: Mano Brown]
Pela primeira vez vi o sistema aos meu pés
Apavorei, desempenho nota dez
Dinheiro na mão, o cofre já tava aberto
O segurança tentou ser mais esperto, então
Foi defender o patrimônio do playboy, cuzão. (tiros)
Não vai dar mais pra ser super-herói
Se o seguro vai cobrir (hehe), foda-se, e daí?
Huh, O Guina não tinha dó
Se reagir, bum, vira pó
Sinto a garganta ressecada
E a minha vida escorrer pela escada
Mas se eu sair daqui, eu vou mudar

[Refrão]
Eu tô ouvindo alguém me chamar
Eu tô ouvindo alguém me chamar

[Verso 3: Mano Brown]
Tinha um maluco lá na rua de trás
Que tava com moral até demais
Ladrão, ladrão, e dos bons
Especialista em invadir mansão
Comprava brinquedo a reveria
Chamava a molecada e distribuía
Sempre que eu via ele tava só
O cara é gente fina, mas eu sou melhor
Eu aqui na pior, ele tem o que eu quero
Joia escondida e uma 380
Num desbaratino, ele até se crescia
Se pá, ignorava até que eu existia
Tem um brilho na janela, é então
A bola da vez tá vendo televisão
(Psiu... Vamo, vai, entramo)
Guina no portão, eu e mais um mano
(Como é que é, neguinho?)
Humm... Se dirigia a mim, e ria, ria, como se eu não fosse nada
Ria, como fosse ter virada
Estava em jogo, meu nome e atitude (tiros)
Era uma vez Robin Hood
Fulano sangue ruim, caiu de olho aberto
Tipo me olhando, é, me jurando
Eu tava bem de perto e acertei os seis
O Guina foi e deu mais três
Lembro que um dia o Guina me falou
Que não sabia bem o que era amor
Falava quando era criança
Uma mistura de ódio, frustração e dor
De como era humilhante ir pra escola
Usando a roupa dada de esmola
De ter um pai inútil, digno de dó
Mais um bêbado, filho da puta e só
Sempre a mesma merda, todo dia igual
Sem feliz aniversário, Páscoa ou Natal
Longe dos cadernos, bem depois
A primeira mulher e o 22
Prestou vestibular no assalto do busão
Numa agência bancária se formou ladrão
Não, não se sente mais inferior
Aí neguinho, agora eu tenho o meu valor
Guina, eu tinha mó admiração, ó
Considerava mais do que meu próprio irmão, ó
Ele tinha um certo dom pra comandar
Tipo, linha de frente em qualquer lugar
Tipo, condição de ocupar um cargo bom e tal
Talvez em uma multinacional
É foda; pensando bem, que desperdício
Aqui na área acontece muito disso
Inteligência e personalidade
Mofando atrás da porra de uma grade
Eu só queria ter moral e mais nada
Mostrar pro meu irmão
Pros cara da quebrada
Uma caranga e uma mina de esquema
Algum dinheiro resolvia o meu problema
O que que eu tô fazendo aqui?
Meu tênis sujo de sangue, aquele cara no chão
Uma criança chorando e eu com um revólver na mão
Ou era um quadro do terror, e eu que fui ao autor
Agora é tarde, eu já não podia mais
Parar com tudo, nem tentar voltar atrás
Mas no fundo, mano, eu sabia
Que essa porra ia zoar minha vida um dia
Me olhei no espelho e não reconheci
Estava enlouquecendo, não podia mais dormir
Preciso ir até o fim
Será que Deus ainda olha pra mim?
Eu sonho toda madrugada
Com criança chorando e alguém dando risada
Não confiava nem na minha própria sombra
Mas segurava a minha onda
Sonhei que uma mulher me falou, eu não sei o lugar
Que um conhecido meu (quem?) ia me matar
Precisava acalmar a adrenalina
Precisava parar com a cocaína
Não tô sentindo meu braço
Nem me mexer da cintura pra baixo
Ninguém na multidão vem me ajudar
Que sede da porra, eu preciso respirar
Cadê meu irmão?
You might also like[Refrão]
Eu tô ouvindo alguém me chamar

[Verso 4: Mano Brown]
Nunca mais vi meu irmão
Diz que ele pergunta de mim, não sei não
A gente nunca teve muito a ver
Outra ideia, outro rolê
Os maluco lá do bairro
Já falava de revólver, droga, carro
Pela janela da classe, eu olhava lá fora
A rua me atraía mais do que a escola
Fiz dezessete, tinha que sobreviver
Agora eu era um homem, tinha que correr
No mundão, você vale o que tem
Eu não podia contar com ninguém
Cuzão, fica você com seu sonho de doutor
Quando acordar cê me avisa, morô?
Eu e meu irmão, era como óleo e água
Quando eu saí de casa, trouxe muita mágoa
Isso a mais ou menos seis anos atrás
Porra, mó saudade do meu pai!
Me chamaram pra roubar um posto
Eu tava duro, era mês de agosto
Mais ou menos três e meia, à luz do dia
Tudo fácil demais, só tinha um vigia
Não sei, não deu tempo, eu não vi, ninguém viu
Atiraram na gente, o moleque caiu
Prometi pra mim mesmo, era a última vez
Porra, ele só tinha dezesseis
Não, não, não, tô afim de parar
Mudar de vida, ir pra outro lugar
Um emprego decente, sei lá
Talvez eu volte a estudar
Dormir à noite era difícil pra mim
Medo, pensamento ruim
Ainda ouço gargalhadas, choro e vozes
A noite era longa, mó neurose
Tem uns malucos atrás de mim
Qual que é? Eu nem sei
Diz que o Guina tá em cana e eu que caguetei
Logo quem, logo eu, olha só, ó
Que sempre segurei os B.O
Não, eu não sou bobo, eu sei qual é que é!
Mas eu não tô com esse dinheiro que os cara quer
Maior que o medo, o que eu tinha era decepção
A traíragem, a pilantragem, a traição
Meus aliado, meus mano, meus parceiro
Querendo me matar por dinheiro
Vivi sete anos em vão
Tudo que eu acreditava não tem mais razão, não
Meu sobrinho nasceu
Diz que o rosto dele é parecido com o meu
É, diz, um pivete eu sempre quis
Meu irmão merece ser feliz
Deve estar a essa altura
Bem perto de fazer a formatura
Acho que é Direito, advocacia
Acho que era isso que ele queria
Sinceramente, eu me sinto feliz
Graças a Deus, não fez o que eu fiz
Minha finada mãe, proteja o seu menino
O Diabo agora guia o meu destino
Se o Júri for generoso comigo
Quinze anos pra cada latrocínio
Sem dinheiro pra me defender
Homem morto, cagueta, sem ser
Que se foda, deixa acontecer
Não há mais nada a fazer
Essa noite eu resolvi sair
Tava calor demais, não dava pra dormir
Ia levar meu canhão, sei lá, decidi que não
É rapidinho, não tem precisão
Muita criança, pouco carro, vou tomar um ar
Acabou meu cigarro, vou até o bar
(E aí, como é que é, e aquela lá ó?)
Tô devagar, tô devagar
Tem uns baratos que não dá pra perceber
Que tem mó valor e você não vê
Uma pá de árvore na praça, as crianças na rua
O vento fresco na cara, as estrela, a lua
Dez minutos atrás, foi como uma premonição
Dois moleque caminharam em minha direção
Não vou correr, eu sei do que se trata
Se é isso que eles querem
Então vem, me mata
Disse algum barato pra mim que eu não escutei
Eu conhecia aquela arma, é do Guina, eu sei
Uma 380 prateada, que eu mesmo dei
Um moleque novato com a cara assustada
(Aí mano, o Guina mandou isso aqui pra você!)
Mas depois do quarto tiro eu não vi mais nada
Sinto a roupa grudada no corpo
Eu quero viver, não posso estar morto
Mas se eu sair daqui eu vou mudar
Eu tô ouvindo alguém me chamar4Embed",to-ouvindo-alguem-me-chamar,Racionais-mcs
18,SobrevivendonoInferno,"Rapaz Comum LyricsLetra de ""Rapaz Comum"" com Racionais MC's

[Intro]

[Verso 1: Edi Rock (Ice Blue)]
Parece que alguém está me carregando perto do chão
Parece um sonho, parece uma ilusão
A agonia, o desespero toma conta de mim
Algo no ar me diz que é muito ruim
Meu sangue quente, não sinto dor
A mão dormente não sente o próprio suor
Meu raciocínio fica meio devagar
Quem me fodeu? Eu tô tentando me lembrar
Cresceu o movimento ao meu redor
Meu Deus! Eu não sei mais o que é pior
Mentir a vida toda pra si mesmo
Ou continuar e insistir no mesmo erro
Me lembro de um fulano: (Mata esse mano!)
Será que errar dessa forma é humano?
Errar a vida inteira é muito fácil
Pra sobreviver aqui tem que ser mágico
Me lembro de várias coisas ao mesmo tempo
Como se eu estivesse perdendo tempo
(A ironia da vida é foda!)
Que valor tem? Quanto valor tem?
Uma vida vale muito, vim saber só agora
Deitado aqui e os manos na paz, tudo lá fora
Puxando ferro ou talvez batendo uma bola
(Pode crer, Deve tá mó lua da hora)
Tem alguém me chamando, quem é?
Apertando minha mão, tem voz de mulher
O choro a faz engolir as palavras
Um lenço que enxuga meu suor enxuga suas próprias lágrimas
No rosto de uma mãe que reza baixinho
Que nunca me deixou faltar, ficar sozinho
Me ensinou o caminho desde criança
Minha infância, mais uma eu guardo na lembrança
Na esperança da periferia eu sou mais um
[Refrão: Edi Rock (Sample)]
(Clip, clap, bum!)
Rapaz comum
(Clip, clap, bum!)
(A lei da selva é assim)
(Clip, clap, bum!)
Rapaz comum
(A lei da selva é assim)
(Clip, clap, bum!)
(Predatória)
Rapaz comum
(Preserve a sua glória!) (2x)

[Verso 2: Edi Rock (Ice Blue)]
Queria atrasar o meu relógio
Pra mim vale muito um minuto a mais de ódio
Mas me sinto fraco, indefeso, desprotegido
Eu vou mais alto, cuzão! Pra te levar comigo!
Vou ser um encosto na sua vida
Você criou um monstro sem cura, sem alternativa!
Me enganar pra quê?
Se o fim é virar pó!
Fiquei muito pior
Segura o seu B.O.!
O preto aqui não tem dó!
Mais uma vida desperdiçada e é só
Uma bala vale por uma vida do meu povo
No pente tem quinze, sempre há menos no morro, e então?
Quantos manos iguais a mim se foram?
Preto, preto, pobre, cuidado, socorro!
Quê que pega aqui? Quê que acontece ali?
Vejo isso frequentemente, desde moleque
Quinze de idade já era o bastante, então
Treta no baile, então, tiros de monte!
Morte nem se fala!
Eu vejo um cara agonizando!
(Chame a ambulância! Alguém chame a ambulância!)
Depois ficava sabendo na semana
Que dois já era
Os preto sempre teve fama
No jornal, revista e TV se vê
Morte aqui é natural, é comum de se ver
Caralho! Não quero ter que achar normal
Ver um mano meu coberto com jornal!
É mal, Cotidiano suicida!
Quem entra tem passagem só pra ida!
Me diga, me diga: que adianto isso faz?
Me diga, me diga: que vantagem isso traz?
Então, a fronteira entre o Céu e o Inferno tá na sua mão
Nove milímetros de ferro
Cuzão! Otário! Que porra é você?
Olha no espelho e tenta entender
A arma é uma isca pra fisgar
Você não é polícia pra matar!
É como uma bola de neve
Morre um, dois, três, quatro
Morre mais um em breve
Sinto na pele, me vejo entrando em cena
Tomando tiro igual filme de cinema
You might also like[Refrão]
(Clip, clap, bum!)
Rapaz comum
(Clip, clap, bum!)
(A lei da selva é assim)
(Clip, clap, bum!)
Rapaz comum
(A lei da selva é assim)
(Clip, clap, bum!)
(Predatória)
Rapaz comum
(Preserve a sua glória!) (2x)

[Verso 3: Edi Rock]
Minha idéia tá clareando
Eu fico atacado, mó neurose, o tempo tá esgotando
Não quero admitir, meus olhos vão abrir
Vou chorar, vou sorrir, vou me despedir
Não quero admitir que sou mais um
Infelizmente é assim, aqui é comum
Um corpo a mais no necrotério, é sério
Um preto a mais no cemitério, é sério
Eu tô me vendo agora e é difícil
Minha família, meus manos, no centro um crucifixo
Meus filhos olhando sem entender o porquê
Se eu pudesse falar talvez iriam saber
Não acredito que esse mano veio até aqui!
Me matou, quer certeza e quer conferir
Me acompanham até a sepultura
Vejo um tumulto no caixão. Hã! E alguém segura!
Mais uma mãe que não se conforma
Perder um filho dessa forma é foda
Quem se conforma?
Como eu podia imaginar no velório de outras pessoas
Hoje estou no lugar
No buraco desce o meu caixão
Jogam terra, flores, se despedem na última oração
Tão me chamando, meu tempo acabou
Não sei pra onde ir! Não sei pra onde vou!
Qual que é? Qual que é? O quê que eu vou ser?
Talvez um anjo de guarda pra te proteger
Não sou o último nem muito menos o primeiro
A lei da selva é uma merda e você é o herdeiro!1Embed",rapaz-comum,Racionais-mcs
19,SobrevivendonoInferno,,,Racionais-mcs
