,album,lyric,title,artist
24,SobrevivendonoInferno,"Fórmula Mágica da Paz LyricsLetra de ""Fórmula Mágica da Paz"" com Racionais MC's & Dago Miranda

[Verso 1: Mano Brown]
Essa porra é um campo minado
Quantas vezes eu pensei em me jogar daqui?
Mas, aí, minha área é tudo o que eu tenho
A minha vida é aqui e eu não consigo sair
É muito fácil fugir mas eu não vou
Não vou trair quem eu fui, quem eu sou
Eu gosto de onde eu tô e de onde eu vim
Ensinamento da favela foi muito bom pra mim
Cada lugar um lugar, cada lugar uma lei
Cada lei uma razão e eu sempre respeitei
Qualquer jurisdição, qualquer área
Jd. Santo Eduardo, Grajaú, Missionária
Funchal, Pedreira e tal, Joaniza
Eu tento advinhar o que você mais precisa
Levantar sua goma ou comprar uns pano
Um advogado pra tirar seu mano
No dia da visita você diz
Que eu vou mandar cigarro pros maluco lá no x
Então, como eu tava dizendo, sangue bom
Isso não é sermão, ouve aí, tenho o dom
Eu sei como é que é, é foda parceiro
É, a maldade na cabeça o dia inteiro
Nada de roupa, nada de carro, sem emprego
Não tem ibope, não tem rolê, sem dinheiro
Sendo assim, sem chance, sem mulher
Você sabe muito bem o que ela quer (é)
Encontre uma de caráter se você puder
É embaçado ou não é?
Ninguém é mais que ninguém, absolutamente
Aqui quem fala é mais um sobrevivente
Eu era só um moleque, só pensava em dançar
Cabelo black e tênis All Star
Na roda da função mó zoeira
Tomando vinho seco em volta da fogueira
A noite inteira, só contando história
Sobre o crime, sobre as treta na escola
Eu não tava nem aí, nem levava nada a sério
Admirava os ladrão e os malandro mais velho
Mas se liga, olhe ao seu redor e me diga:
O que melhorou? da função quem sobrou?
Sei lá, muito velório rolou de lá pra cá
Qual a próxima mãe que vai chorar?
Ha, demorou mas hoje eu posso compreender
Que malandragem de verdade é viver
Agradeço a Deus e aos Orixás
Parei no meio do caminho e nem olhei pra trás
Meus outros manos todos foram longe demais
Cemitério São Luiz aqui jaz
Mas que merda, meu oitão tá até a boca
Que vida louca! Por que é que tem que ser assim?
Ontem eu sonhei que um fulano aproximou de mim
""Agora eu quero ver ladrão"" (pá! pá! pá! pá!) e fim
É, sonho é sonho, deixa quieto
Sexto sentido é um dom, eu tô esperto, morrer é um fator
Mas conforme for, tem no bolso e na agulha e mais 5 no tambor
Joga o jogo, vamo lá, caiu a 8 eu mato a par
Eu não preciso de muito pra sentir-me capaz
De encontrar a Fórmula Mágica da Paz
[Refrão: Dagô Miranda (Mano Brown)]
Eu vou procurar, sei que vou encontrar, eu vou procurar
Eu vou procurar, você não bota uma fé, mas eu vou atrás
{Eu vou procurar e sei que vou encontrar}
(Da minha fórmula mágica da paz)
Eu vou procurar, sei que vou encontrar
(Procure a sua) eu vou procurar, eu vou procurar
Você não bota uma fé
(Eu vou atrás da minha) Você não bota uma fé
{Eu vou procurar e sei que vou encontrar}

[Verso 2: Mano Brown, Ice Blue]
Caralho, que calor, que horas são agora?
Dá pra ouvir a pivetada gritando lá fora
Hoje, acordei cedo pra ver
Sentir a brisa de manhã e o sol nascer
É época de pipa, o céu tá cheio
15 anos atrás eu tava ali no meio
Lembrei de quando era pequeno, eu e os cara
Faz tempo, faz tempo e o tempo não para
Hoje tá da hora o esquema pra sair
É, vamo, não demora, mano, chega aí
Cê viu onti? os tiro ouvi um monte, então
Diz que tem uma pá de sangue no campão
Ih, mano toda mão é sempre a mesma ideia junto
Treta, tiro, sangue, aí, muda de assunto
Traz a fita pra ouvir porque eu tô sem
Principalmente aquela lá do Jorge Ben
Uma pá de mano preso chora a solidão
Uma pá de mano solto sem disposição
Empenhorando por aí, rádio, tênis, calça
Acende num cachimbo, virou fumaça!
Não é por nada não, mas aí, nem me ligo, ó
A minha liberdade eu curto bem melhor
Eu não tô nem aí pra o que os outros fala
4, 5, 6, preto num Opala
Pode vir gambé, paga pau, tô na minha na moral
Na maior, sem goró, sem pacau, sem pó
Eu tô ligeiro, eu tenho a minha regra
Não sou pedreiro, não fumo pedra
Um rolê com os aliados já me faz feliz
Respeito mútuo é a chave é o que eu sempre quis (Diz)
Procure a sua, a minha eu vou atrás
Até mais, da fórmula mágica da paz
You might also like[Refrão: Dagô Miranda (Mano Brown)]
Eu vou procurar, sei que vou encontrar, eu vou procurar
Eu vou procurar, você não bota uma fé, mas eu vou atrás
{Eu vou procurar e sei que vou encontrar}
(Da minha fórmula mágica da paz)
Eu vou procurar, sei que vou encontrar
(Procure a sua) eu vou procurar, eu vou procurar
Você não bota uma fé
(Eu vou atrás da minha) Você não bota uma fé
{Eu vou procurar e sei que vou encontrar}

[Verso 3: Mano Brown]
Choro e correria no saguão do hospital
Dia das criança, feriado e luto final
Sangue e agonia entra pelo corredor
""Ele tá vivo? Pelo amor de Deus, doutor""
4 tiros do pescoço pra cima
Puta que pariu a chance é mínima
Aqui fora, revolta e dor
Lá dentro estado desesperador
Eu percebi quem eu sou realmente
Quando eu ouvi o meu subconsciente:
(E aí mano brown, cuzão? cadê você?
Seu mano tá morrendo o que você vai fazer?)
Pode crer, eu me senti inútil, eu me senti pequeno
Mais um cuzão vingativo, vai vendo
Puta desespero, não dá pra acreditar
Que pesadelo, eu quero acordar
Não dá, não deu, não daria de jeito nenhum
O Derley era só mais um rapaz comum
Dali a poucos minutos
Mais uma Dona Maria de luto
Na parede o sinal da cruz
Que porra é essa? Que mundo é esse? Onde tá Jesus?
Mais uma vez um emissário
Não incluiu o Capão Redondo em seu itinerário
Porra, eu tô confuso, preciso pensar
Me dá um tempo pra eu raciocinar
Eu já não sei distinguir quem tá errado, sei lá
Minha ideologia enfraqueceu:
Preto, branco, polícia, ladrão ou eu?
Quem é mais filha da puta, eu não sei
Aí fudeu, fudeu, decepção essas hora
A depressão quer me pegar vou sair fora
2 de novembro era finados
Eu parei em frente ao São Luís do outro lado
E durante uma meia hora olhei um por um
E o que todas as senhoras tinham em comum:
A roupa humilde, a pele escura
O rosto abatido pela vida dura
Colocando flores sobre a sepultura
(Podia ser a minha mãe) Que loucura
Cada lugar uma lei, eu tô ligado
No extremo sul da Zona Sul tá tudo errado
Aqui vale muito pouco a sua vida
A nossa lei é falha, violenta e suicida
Se diz que, me diz que, não se revela:
Parágrafo primeiro na lei da favela
Legal, assustador é quando se descobre
Que tudo deu em nada e que só morre o pobre
A gente vive se matando irmão, por quê?
Não me olha assim, eu sou igual a você
Descanse o seu gatilho, descanse o seu gatilho
Entre no trem da malandragem, meu rap é o trilho
Vou dizer...

[Outro]
Pra todas a famílias ai que perderam pessoas importante morô, meu?
Não se acostume com esse cotidiano violento
Que essa não é a sua vida, essa não é a minha vida morô, mano?
Aí Derlei, descanse em paz!
Aí Carlinhos procure a sua paz!
Aí quico, você deixou saudade morô, mano?
(Agradeço à Deus e aos Orixás)
Eu tenho muito a agradecer por tudo
(Agradeço à Deus e aos Orixás)
{Eu vou procurar e sei que vou encontrar}
Cheguei aos 27, sou um vencedor, tá ligado mano?
(Agradeço à Deus e aos Orixás)
Aí procure a sua, eu vou atrás da minha fórmula mágica da paz
{Eu vou procurar e sei que vou encontrar}
Aí, manda um toque na quebrada lá, Cohab, adventista e pá rapaziada
(Malandragem de verdade é viver)
Se liga, procure a sua paz
Aqui quem fala é Mano Brown mais um sobrevivente
27 anos contrariando as estatística, morô?
Procure a sua, você pode encontrar sua paz, seu paraíso, você pode encontrar seu inferno
Eu procuro a paz2Embed",formula-magica-da-paz,Racionais-mcs
25,SobrevivendonoInferno,"Salve Lyrics[Mano Brown & Ice Blue]
Eu vou mandar um salve pra comunidade do outro lado do muro. As grades nunca vão prender nosso pensamento, mano. Se liga aí Jardim Evana, Parque do Engenho, Gerivá, Jardim Rosana, Pirajusara, Santa Tereza

Vaz de lima, Parque Santo Antônio, Capelinha, João
Morá, Vila Calu, Branca flor, Paranapanema
Iaracati

Novo Oriente, Parque Arariba, Jardim Ingá, Parque
Ipê, Pessoal Da Sabin, Jardim Marcelo, Cidade Ademar
Jardim São Carlos, Jardim Primavera, Santa Amélia
Jardim Santa Terezinha, Jardim Míriam, Vila Santa
Catarina
Aí Vietinã, Cocáia, Cipó, Colônia, Campanário De
Diadema, Calux E São Bernardo...
Vila Industrial Santo André, Bairro Das Pimentas
Brasilândia, Jardim Japão, Jardim Ebron, Coabi 1
Coabi 2, São Matheus, Itai, Cidade Tiradentes
Barueri, Coabi De Tapas
Mangueira, Borel, Cidade De Deus, E Ai DF, Expansão
P Norte, P Sul
E Ai Pessoal Do Sul, Restinga
E Ai Quebradas, Zona Noroeste Santos, Rádio Favela
Bh, E Pra Todos Os Aliados Espalhados Pelas Favelas Do
Brasil
Firma!

Todos os DJs, todos os MCs, que fazem do rap a trilha sonora do gueto
E pros filha da puta que querem jogar minha cabeça pros porcos, aí, tenta a sorte mano
Eu acredito na palavra de um homem de pele escura, de cabelo crespo, que andava entre mendigos e leprosos pregando a igualdade
Um homem chamado Jesus
Só ele sabe a minha hora
Aí ladrão, to saindo fora
PazYou might also likeEmbed",salve,Racionais-mcs
26,NadaComoUmDiaApósoOutroDiaDisco1ChoraAgora,"Sou + Você Lyrics[Letra de ""Sou + Você"" com Racionais MC's]
[Interlúdio: Mano Brown]
Bença, mãe
Estamos iniciando nossas transmissões
Essa é a sua rádio Exodus
Hey, hey
Vamo' acordar, vamo' acordar
Porque o sol não espera, demorô'
Vamo' acordar, o tempo não cansa
Ontem à noite você pediu, você pediu
Uma oportunidade, mais uma chance
Como Deus é bom, né não, nego?
Olha aí, mais um dia, todo seu
Que céu azul louco, em
Vamo' acordar, vamo' acordar
Agora vem com a sua cara
Sou mais você nessa guerra
A preguiça é inimiga da vitória
O fraco não tem espaço e o covarde morre sem tentar
Não vou te enganar, o bagulho tá doido
Ninguém confia em ninguém, nem em você
E os inimigos vêm de graça
É a selva de pedra, ela esmaga os humilde' demais
Você é do tamanho do seu sonho
Faz o certo, faz a sua
Vamo' acordar, vamo' acordar
Cabeça erguida, olhar sincero
Tá com medo de quê? Nunca foi fácil
Junta os seus pedaços e desce pra arena
Mas lembre-se: aconteça o que aconteça
Nada como um dia após um outro diaYou might also like1Embed",sou-voce,Racionais-mcs
27,NadaComoUmDiaApósoOutroDiaDisco1ChoraAgora,"Vivão e Vivendo Lyrics[Letra de ""Vivão e Vivendo"" com Racionais MC's]

[Intro]
É nós me'mo, vagabundo!
Demorô'! Ô não
Firmão!

[Interlúdio: Mano Brown]
Você está nas ruas de São Paulo
Onde vagabundo guarda o sentimento na sola do pé
Não é pessimismo, não, é assim que é
Vivão e vivendo, guerreiro tira chinfra
É o doce veneno
Viajei, voltei pra você, voltei pelos louco'
Voltei pelos preto', e pelas verde', consequentemente
Meu Deus!
É quente! Ha ha
É desse jeito
Ei, você, sonhador que ainda acredita, liga nós
Eu tenho fé, amor e afeto no século vinte e um
Onde as conquistas científicas, espaciais, medicinais
E a confraternização dos homens, e a humildade de um rei
Serão as armas da vitória para a paz universal
Ei, pé de breque, vai pensando que 'tá bom
Todo mundo vai ouvir, todo mundo vai saber
[Refrão: Mano Brown]
Tem que ser vagabundo
Tem que ser vagabundo
Tem que ser

[Interlúdio: Mano Brown]
Se eu me perco na noite, eu não me acho de dia
Ei, tentação, dá uma estia
Faz assim pro meu coração
Minha mente é um labirinto e meu coração chora
Chora agora, ri depois, ha ha
Vem comigo, nego, vem comigo, nego
Tá tudo aí pra nós, só saber chegar
Vem comigo, nego, vem comigo, nego
Com Deus no coração, o resto nós resolve
Ó, ligaram nós, demorô', s'imboraYou might also likeEmbed",vivao-e-vivendo,Racionais-mcs
28,NadaComoUmDiaApósoOutroDiaDisco1ChoraAgora,"Vida Loka (Intro) Lyrics[Letra de ""Vida Loka (Intro)"" com Racionais MC's]

[Interlúdio]
– Então, demorô', mano. 'Tá em cima?
– 'Tá em cima
– Então, é no 21B
– Se roncar, nós pega (Toque de campainha)
– Demorô', demorô', acho que é aqui
– Aí, o Brown tá aí, irmão?You might also likeEmbed",vida-loka-intro,Racionais-mcs
29,NadaComoUmDiaApósoOutroDiaDisco1ChoraAgora,"Vida Loka, Pt. 1 Lyrics[Letra de ""Vida Loka, Pt. 1"" com Racionais MC's]
[Intro: Mano Brown | Negredo | Edi Rock]
– Vagabunda, queria atacar do malucão, usou meu nome. O pipoca abraçou, foi na porta da minha casa lá, botou pânico em todo mundo, três horas da tarde, eu não 'tava lá. Vai vendo
– Mas aí, Brown, ó. Tem uns tipo de mulher aí, truta, que não dá nem pra comentar
– E eu nem sei quem é os maluco', isso que é foda
– Ih, vamo' atrás desses pipoca' aí, e já era
– Ir atrás de quem? E aonde? Sei nem quem é, mano. Mano, não devo, não temo, me dá meu copo que já era

[Interlúdio: Mano Brown | Abraão]
– E aí, bandido mau, como é que é, meu parceiro?
– E aí, Abraão. Firmão, truta?
– Firmeza total, ó, Brown. E a quebrada aí, irmão?
– 'Tá a pampa. Aí, fiquei sabendo do seu pai, aí, lamentável, em, truta, meu sentimento me'mo, em, mano
– Vai vendo, Brown, meu pai morreu, nem deixaram eu ir no enterro do meu coroa, irmão
– 'Cê é louco. 'Cê tava onde na hora, mano?
– Eu tava batendo uma bola, meu. Fiquei na mó' neurose, irmão
– Aí foram te avisar?
– Aí vieram me avisar. Mas 'tá firmão, Brown, 'tá firmão. Logo mais, eu 'tô aí na quebrada com vocês, aí
– É quente, na rua também não tá fácil, não, 'morô', truta. Uns juntando inimigo, outros juntando dinheiro. Sempre tem um pra testar sua fé, mas tá ligado, sempre tem um corre a mais pra fazer. Aí, mano, liga, liga nós aí, qualquer coisa, 'cê tá ligado, mano, é lado a lado nós até o fim, 'morô', irmão?
– Tô ligado
[Verso 1: Mano Brown]
Fé em Deus, que ele é justo
Ei, irmão, nunca se esqueça
Na guarda, guerreiro, levanta a cabeça
Truta, onde estiver, seja lá como for
Tenha fé, porque até no lixão nasce flor
Ore por nós, pastor, lembra da gente
No culto dessa noite, firmão, segue quente
Admiro os crente', dá licença aqui
Mó' função, mó' tabela, ô, desculpa aí
Eu me sinto, às vezes, meio, pá, inseguro
Que nem um vira-lata, sem fé no futuro
Vem alguém lá, quem é quem, quem será? Meu bom
Dá meu brinquedo de furar moletom
Porque os bico' que me vê com os truta' na balada
Tenta ver, quer saber de mim, não vê nada
Porque a confiança é uma mulher ingrata
Que te beija e te abraça, te rouba e te mata
Desacreditar? Nem pensar, só naquela
Se uma mosca ameaçar me catar, piso nela
O bico deu mó guela, ó
Pique bandidão, foi em casa na missão: me trombar na Cohab
De camisa larga, vai saber, Deus que sabe
Qual é a maldade comigo, inimigo no migué
Tocou a campainha, plim, pra tramar meu fim
Dois maluco armado, sim, um isqueiro e um estopim
Pronto pra chamar a minha preta pra falar
Que eu comi a mina dele, ha, se ela 'tava lá
Vadia, mentirosa, nunca vi, deu mó' fá'ia
Espírito do mal, cão de buceta e saia
Talarico nunca fui, é o seguinte
Ando certo pelo certo, como dez e dez é vinte
Já pensou, doido, e se eu 'tô com o meu filho
No sofá, de vacilo, desarmado, era aquilo
Sem culpa e sem chance, nem pra abrir a boca
Ia nessa sem saber, (Pr'ocê ver) vida louca
You might also like[Interlúdio: Mano Brown | Abraão]
– E aí, Brown, nós 'tá aqui dentro, mas demorô', truta, liga nós, irmão
– Não, truta, aí, jamais vou levar problema pro'cês. Nós resolve na rua, e rapidinho também. Mas, aí, nem esquenta. Aí, e aquele jogo lá do final do ano que 'cê falou?
– Então, truta, demorô', ó. No final do ano nós vai' marcar aquele jogo lá. Vem você, o Blue, os cara do Racionais, tudo aí, 'morô', meu? Visita aqui é sagrada, safado não atravessa, não, 'morô'?

[Verso 2: Mano Brown]
Mas na rua não é, não
Até Jack, tem quem passe um pano
Impostor, pé de breque, passa por malandro
A inveja existe, e a cada dez, cinco é na maldade
A mãe dos pecado' capital' é a vaidade
Mas se é para resolver, se envolver, vai meu nome
Eu vou fazer o quê, se cadeia é pra homem?
Malandrão, eu? Não, ninguém é bobo
Se quer guerra, terá, se quer paz, quero em dobro
Mas, verme é verme, é o que é
Rastejando no chão, sempre embaixo do pé
E fala uma, duas vez', se marcar, até três
Na quarta, cheque-mate, que nem no xadrez
Eu sou guerreiro do rap, e sempre em alta voltagem
Um por um, Deus por nós, 'tô aqui de passagem
Vida louca, eu não tenho dom pra vítima
Justiça e liberdade, a causa é legítima
Meu rap faz o cântico dos louco' e dos romântico'
Vou pôr um sorriso de criança onde for
Pros parceiros, tenho a oferecer minha presença
Talvez até confusa, mas real e intensa
Meu melhor, Marvin Gaye, sabadão na Marginal
O que será, será, é nós, vamo' até o final
Liga eu, liga nós, onde preciso for
No Paraíso ou no Dia do Juízo, pastor
E liga eu e os irmão', é o ponto que eu peço
Favela, Fundão, imortal nos meus verso'
Vida louca
[Saída: Mano Brown | Abraão]
– E aí, Brown, e os pião', irmão?
– 'Tô com os mano aí, eu vou... 'tô indo ali na Zona Leste, ali. Tipo, umas onze horas eu já 'tô voltando, já, 'morô' irmão?
– Aí, Brown, se pá é a contagem, 'morô', mano? Aí, eu vou desligar, mas manda um salve pros mano' aí da quebrada, aí, morô? Pro Gil, 'morô', mano, pro Batatão, pro Pacheco, pro Porquinho, pro Xandi, pro Dé, 'morô', meu. Aí, e no dia do jogo, 'morô', os mano' do Exaltasamba vai' vir. Manda um salve pro Binha, lá, 'morô', Brown. Fica com Deus, irmão10Embed",vida-loka-pt-1,Racionais-mcs
30,NadaComoUmDiaApósoOutroDiaDisco1ChoraAgora,"TranslationsEnglishNegro Drama Lyrics[Letra de ""Negro Drama"" com Racionais MC's]

[Verso 1: Edi Rock]
Negro drama, entre o sucesso e a lama
Dinheiro, problemas, inveja, luxo, fama
Negro drama, cabelo crespo e a pele escura
A ferida, a chaga, à procura da cura
Negro drama, tenta ver e não vê nada
A não ser uma estrela, longe, meio ofuscada
Sente o drama, o preço, a cobrança
No amor, no ódio, a insana vingança
Negro drama, eu sei quem trama e quem tá comigo
O trauma que eu carrego pra não ser mais um preto fodido
O drama da cadeia e favela
Túmulo, sangue, sirene, choros e velas
Passageiro do Brasil, São Paulo, agonia
Que sobrevive em meio às honras e covardias
Periferias, vielas, cortiços
Você deve tá pensando o que você tem a ver com isso
Desde o início, por ouro e prata
Olha quem morre, então, veja você quem mata
Recebe o mérito, a farda que pratica o mal
Me ver pobre preso ou morto já é cultural
Histórias, registros, escritos
Não é conto, nem fábula, lenda ou mito
Não foi sempre dito que preto não tem vez? Então
Olha o castelo e não foi você quem fez, cuzão
Eu sou irmão dos meus trutas de batalha
Eu era a carne, agora sou a própria navalha
Tim-tim! Um brinde pra mim
Sou exemplo de vitórias, trajetos e glórias
O dinheiro tira um homem da miséria
Mas não pode arrancar, de dentro dele, a favela
São poucos que entram em campo pra vencer
A alma guarda o que a mente tenta esquecer
Olho pra trás, vejo a estrada que eu trilhei, mó cota
Quem 'teve lado a lado e quem só ficou na bota
Entre as frases, fases e várias etapas
Do quem é quem, dos mano' e das mina' fraca'
Hm, negro drama de estilo
Pra ser, se for, tem que ser; se temer, é milho
Entre o gatilho e a tempestade
Sempre a provar que sou homem e não um covarde
Que Deus me guarde, pois eu sei que ele não é neutro
Vigia os ricos, mas ama os que vêm do gueto
Eu visto preto por dentro e por fora
Guerreiro, poeta entre o tempo e a memória, ora
Nessa história, vejo dólar e vários quilates
Falo pro mano que não morra e, também, não mate
O tique-taque não espera, veja o ponteiro
Essa estrada é venenosa e cheia de morteiro
Pesadelo? Hmm, é um elogio
Pra quem vive na guerra, a paz nunca existiu
No clima quente, a minha gente sua frio
Vi um pretinho: seu caderno era um fuzil
[Interlúdio: Mano Brown]
Crime, futebol, música... Caralho!
Eu também não consegui fugir disso, aí
Eu sou mais um
Forrest Gump é mato
Eu prefiro contar uma história real
Vou contar a minha
[Verso 2: Mano Brown]
Daria um filme
Uma negra e uma criança nos braços
Solitária na floresta de concreto e aço
Veja, olha, outra vez, o rosto na multidão
A multidão é um monstro sem rosto e coração
Ei, São Paulo, terra de arranha-céu
A garoa rasga a carne, é a Torre de Babel
Família brasileira: dois contra o mundo
Mãe solteira de um promissor vagabundo
Luz, câmera e ação!
Gravando, a cena vai
Um bastardo, mais um filho pardo sem pai
Ei, senhor de engenho, eu sei bem quem você é
Sozinho 'cê num 'guenta, sozinho 'cê num 'guenta, a pé
'Cê disse que era bom e a favela ouviu
Lá também tem uísque e Red Bull, tênis Nike e fuzil
Admito, seus carros é bonito
É, e eu não sei fazer
Internet, vídeo-cassete, uns carros loucos
Atrasado eu tô um pouco, sim, tô, eu acho
Só que tem que—
Seu jogo é sujo e eu não me encaixo
Eu sou problema de montão, de carnaval a carnaval
Eu vim da selva, eu sou leão, sou demais pro seu quintal
Problema com escola eu tenho mil, mil fitas
Inacreditável, mas seu filho me imita
No meio de vocês, ele é o mais esperto
Ginga e fala gíria
""Gíria, não, dialeto!""
Esse não é mais seu, ó, fiiiuuu— Subiu
Entrei pelo seu rádio, tomei, 'cê nem viu
""Nóis é isso, é aquilo""
O quê? 'Cê não dizia?
Seu filho quer ser preto, ah! Que ironia
Cola o pôster do 2Pac, aí, que tal? O que 'cê diz?
Sente o negro drama, vai, tenta ser feliz
Ei, bacana, quem te fez tão bom assim?
O que 'cê deu, o que 'cê faz, o que 'cê fez por mim?
Eu recebi seu tique— quer dizer, kit
De esgoto a céu aberto e parede madeirite
De vergonha, eu não morri, tô firmão, eis-me aqui
Você, não, 'cê não passa quando o Mar Vermelho abrir
Eu sou humano, homem duro, do gueto, Brown, Obá
Aquele louco que não pode errar
Aquele que você odeia amar nesse instante
Pele parda e ouço funk
Vim de onde vêm os diamantes: da lama
Valeu, mãe, negro drama
You might also like[Saída: Mano Brown]
Aí... Na época dos barraco de pau lá na Pedreira
Onde cês tavam? O que é que cês deram por mim? O que é que cês fizeram por mim?
Agora tá de olho no dinheiro que eu ganho?
Agora tá de olho no carro que eu dirijo?
Demorô, eu quero é mais, eu quero até sua alma
Aí, o rap fez eu ser o que sou
Ice Blue, Edi Rock e KL Jay, e toda a família
E toda geração que faz o rap, a geração que revolucionou
A geração que vai revolucionar
Nos anos 90, século 21, é desse jeito
Aí, você sai do gueto, mas o gueto nunca sai de você, morô irmão?
Voce tá dirigindo um carro, o mundo todo tá de olho em você, morô?
Sabe por quê? Pela sua origem, morô irmão?
É desse jeito que você vive, é o Negro Drama
Eu não li, eu não assisti
Eu vivo o Negro Drama, eu sou o Negro Drama
Eu sou o fruto do Negro Drama
Aí, Dona Ana, sem palavras, a senhora é uma rainha, rainha
Mas aí, se tiver que voltar pra favela, eu vou voltar de cabeça erguida
Porque assim que é, renascendo das cinzas
Firme e forte, guerreiro de fé
Vagabundo nato!25Embed",negro-drama,Racionais-mcs
